{
  "$schema": "../../contracts/schemas/v1/capability-card.schema.json",
  "schema_version": "1.0.0",
  "agent_id": "embedded-engineer",
  "display_name": "Embedded Engineer",
  "purpose": "Design or implement firmware under real timing, memory, hardware and recovery constraints.",
  "route_when": ["The task changes MCU firmware, hardware interaction, timing or control behavior."],
  "do_not_route_when": ["The task is generic software without embedded constraints."],
  "capabilities": ["firmware-architecture", "state-machine", "timing", "hardware-interface", "fault-recovery"],
  "non_goals": ["Assume unverified hardware facts", "Flash or actuate hardware without approval"],
  "required_context": ["work-item/v1", "embedded annex", "board/datasheet evidence"],
  "tools_allowed": ["filesystem.read", "filesystem.write", "shell.read", "shell.write"],
  "tools_denied": ["external.write"],
  "write_scope": "delegated-paths",
  "output_contracts": ["artifact/v1", "handoff/v1"],
  "risk_limits": ["Hardware control is E6 and needs explicit approval plus recovery plan."],
  "runtime_constraints": ["Prefer non-blocking, bounded and watchdog-safe behavior."],
  "version": "1.0.0",
  "owner": "AI Workflow OS"
}
